<?xml version="1.0" encoding="UTF-8"?><template xmlns:xsi="http://www.w3.org/2001/XMLSchema-instance" xsi:noNamespaceSchemaLocation="edi_template.xsd">
<settings>
<userInterfaceLanguage xml:lang="it"/>
<metadataLanguage selectionItem="ling_md_1"/>
<metadataEndpoint>https://enygma.it/edi/</metadataEndpoint>
<sparqlEndpoint>http://sparql/sparql.get-it.it/sparql</sparqlEndpoint>
<requiresValidation>false</requiresValidation>
<baseDocument><![CDATA[
            
            
            <swes:InsertSensor xmlns:sos="http://www.opengis.net/sos/2.0"
    xmlns:sml="http://www.opengis.net/sensorML/1.0.1"
    xmlns:swe="http://www.opengis.net/swe/1.0.1"
    xmlns:tns="http://www.w3.org/2005/08/addressing"
    xmlns:xlink="http://www.w3.org/1999/xlink"
    xmlns:gco="http://www.isotc211.org/2005/gco"
    xmlns:gss="http://www.isotc211.org/2005/gss"
    xmlns:gmd="http://www.isotc211.org/2005/gmd"
    xmlns:gml="http://www.opengis.net/gml"
    xmlns:swes="http://www.opengis.net/swes/2.0"
    xmlns:om="http://www.opengis.net/om/2.0"
    xmlns:ows="http://www.opengis.net/ows/1.1"
    xmlns:wstop="http://docs.oasis-open.org/wsn/t-1"
    xmlns:gsr="http://www.isotc211.org/2005/gsr"
    xmlns:gts="http://www.isotc211.org/2005/gts"
    xmlns:xsi="http://www.w3.org/2001/XMLSchema-instance"
    xsi:schemaLocation="http://www.opengis.net/sos/2.0/ http://schemas.opengis.net/sos/2.0/sosInsertSensor.xsd http://www.opengis.net/swes/2.0 http://schemas.opengis.net/swes/2.0/swes.xsd" version="2.0.0" service="SOS">
    <swes:procedureDescriptionFormat>http://www.opengis.net/sensorML/1.0.1</swes:procedureDescriptionFormat>
    <swes:procedureDescription>
        <!-- Licence CC By SA 3.0  http://creativecommon.org/licences/by-SA/3.0 -->
        <sml:SensorML version="1.0.1">
        
        </sml:SensorML>
    </swes:procedureDescription>
<swes:observableProperty></swes:observableProperty>
<swes:metadata>
<sos:SosInsertionMetadata>
<sos:observationType>http://www.opengis.net/def/observationType/OGC-OM/2.0/OM_Measurement</sos:observationType>
<sos:observationType>http://www.opengis.net/def/observationType/OGC-OM/2.0/OM_CategoryObservation</sos:observationType>
<sos:observationType>http://www.opengis.net/def/observationType/OGC-OM/2.0/OM_CountObservation</sos:observationType>
<sos:observationType>http://www.opengis.net/def/observationType/OGC-OM/2.0/OM_TextObservation</sos:observationType>
<sos:observationType>http://www.opengis.net/def/observationType/OGC-OM/2.0/OM_TruthObservation</sos:observationType>
<sos:observationType>http://www.opengis.net/def/observationType/OGC-OM/2.0/OM_GeometryObservation</sos:observationType>
<sos:observationType>http://www.opengis.net/def/observationType/OGC-OM/2.0/OM_SWEArrayObservation</sos:observationType>
<sos:featureOfInterestType>http://www.opengis.net/def/samplingFeatureType/OGC-OM/2.0/SF_SamplingPoint</sos:featureOfInterestType>
</sos:SosInsertionMetadata>
</swes:metadata>
</swes:InsertSensor>
        
        ]]></baseDocument>
<xsltChain>
            <xslt>http://sp7.irea.cnr.it/jboss/MDService/rest/SensorML101.xsl?version=2.00</xslt>
        </xsltChain>
</settings>
<endpointTypes>
<endpointType xml:id="virtuoso" method="GET" queryParameter="query">
<parameters>
<parameter name="format" value="application/sparql-results+json"/>
<parameter name="save" value="display"/>
<parameter name="fname" value="undefined"/>
</parameters>
</endpointType>
<endpointType xml:id="sparqlTemaTres" method="GET" queryParameter="query">
<parameters>
<parameter name="output" value="json"/>
</parameters>
</endpointType>
</endpointTypes>
<datasources>
<codelist xml:id="languages" endpointType="virtuoso">
<uri>http://inspire-registry.jrc.ec.europa.eu/registers/Languages/items</uri>
<url>http://sparql/sparql.get-it.it/sparql</url>
</codelist>
<sparql xml:id="keywordsold" endpointType="virtuoso">
<query><![CDATA[
                
                        PREFIX skos: <http://www.w3.org/2004/02/skos/core#> 
                        SELECT ?c ?l ?a
                        FROM <http://ritmare.it/rdfdata/parameters>
                        WHERE { 
                          ?c rdf:type skos:Concept.
                          OPTIONAL {
                            ?c skos:prefLabel ?l.
                            FILTER( LANG(?l) = "en")
                          }
                          OPTIONAL {
                            ?c skos:prefLabel ?a.
                            FILTER( LANG(?a) = "it")
                          }
                          FILTER( REGEX( STR(?l), "$search_param", "i") || REGEX( STR(?a), "$search_param", "i") )
                        }
                        ORDER BY ASC(?l) ASC(?a) 
                        
            ]]></query>
</sparql>
<singleton xml:id="keywordsSold" endpointType="virtuoso" triggerItem="output_param_1_uri">
<query><![CDATA[
                
                        PREFIX skos: <http://www.w3.org/2004/02/skos/core#>
                        SELECT ?c ?l ?a
                        FROM <http://ritmare.it/rdfdata/parameters>
                        WHERE {
                          ?c rdf:type skos:Concept.
                          OPTIONAL {
                            ?c skos:prefLabel ?l.
                            FILTER( LANG(?l) = "en")
                          }
                          OPTIONAL {
                            ?c skos:prefLabel ?a.
                            FILTER( LANG(?a) = "it")
                          }
                          FILTER( REGEX( STR(?c), "$search_param", "i") || REGEX( STR(?a), "$search_param", "i") )
                        }
                        ORDER BY ASC(?l) ASC(?a)
                        
            ]]></query>
</singleton>
<sparql xml:id="keywords" endpointType="sparqlTemaTres">
<query><![CDATA[
                
                        PREFIX skos: <http://www.w3.org/2004/02/skos/core#>
                         SELECT ?c ?l ?a
                         WHERE {
                            ?c rdf:type skos:Concept.
                            ?c skos:inScheme <http://openskos.lifewatchitaly.eu/PhytoTraits/>.
                            ?c skos:prefLabel ?l.
                            #<http://openskos.lifewatchitaly.eu/PhytoTraits/?tema=130> skos:narrower ?c.
                            OPTIONAL {
                                ?c skos:prefLabel ?a.
                                FILTER( LANG(?a) = "it")
                              }
                            FILTER REGEX( STR(?l), "$search_param", "i")
                        }
                        ORDER BY ASC(?l)
                        
            ]]></query>
<url>http://openskos.lifewatchitaly.eu/PhytoTraits/sparql.php</url>
</sparql>
<singleton xml:id="keywordsS" endpointType="sparqlTemaTres" triggerItem="output_param_1_uri">
<query><![CDATA[
                
                        PREFIX skos: <http://www.w3.org/2004/02/skos/core#>
                         SELECT ?c ?l ?a
                         WHERE {
                            ?c rdf:type skos:Concept.
                            ?c skos:inScheme <http://openskos.lifewatchitaly.eu/PhytoTraits/>.
                            ?c skos:prefLabel ?l.
                            #<http://openskos.lifewatchitaly.eu/PhytoTraits/?tema=130> skos:narrower ?c.
                            OPTIONAL {
                                ?c skos:prefLabel ?a.
                                FILTER( LANG(?a) = "it")
                              }
                            FILTER REGEX( STR(?l), "$search_param", "i")
                        }
                        ORDER BY ASC(?l)
                        
            ]]></query>
</singleton>
<singleton xml:id="manufacturers" endpointType="virtuoso">
<query><![CDATA[
                
                        PREFIX ns: <http://www.w3.org/2006/vcard/ns#>                        
                        SELECT ?c ?l 
                        FROM <http://ritmare.it/rdfdata/manufacturers>
                        WHERE { 
                          ?c rdf:type foaf:Organization.
                          ?c foaf:name ?l.
                          FILTER( REGEX( STR(?l), "$search_param", "i") )
                        }
                        ORDER BY ASC(?l)                        
                        
            ]]></query>
</singleton>
<singleton xml:id="info_manufacturers" endpointType="virtuoso" triggerItem="manuf_name_3_uri">
<query><![CDATA[
                
                        PREFIX addr: <http://wymiwyg.org/ontologies/foaf/postaddress#>
                        PREFIX vcard: <http://www.w3.org/2006/vcard/ns#>
                        SELECT ?phone fn:concat(?l1, ', ', ?l2) AS ?addr ?town ?region ?postcode ?country ?email ?homepage
                        FROM <http://ritmare.it/rdfdata/manufacturers>
                        WHERE { 
                          OPTIONAL {
                            <$search_param> foaf:phone ?phone .
                          }
                          OPTIONAL {
                            <$search_param> vcard:email ?email.
                          }
                          OPTIONAL {
                            <$search_param> foaf:homepage ?homepage.
                          }
                          OPTIONAL {
                            <$search_param> addr:address ?b1.
                          }
                          OPTIONAL {
                            ?b1 addr:deliveryPoint ?b2.
                          }
                          OPTIONAL {
                            ?b2 addr:location ?b3.
                          }
                          OPTIONAL {
                            ?b3 addr:thoroughfareName ?l1.
                          }
                          OPTIONAL {
                            ?b3 addr:streetNr ?l2.
                          }
                          OPTIONAL {
                            ?b3 addr:town ?town.
                          }